Question,Answer,Explanation
Which international organization is dedicated to the promotion of gender equality and women's rights?,UN Women,UN Women focuses on the promotion of gender equality and women's rights.
"The ""Sahara Desert"" is located in which part of Africa?",North,The Sahara Desert is located in the northern part of Africa.
Which country recently became the first to achieve a carbon-neutral status in 2024?,Sweden,Sweden achieved carbon-neutral status in 2024.
"The ""Kyoto Protocol"" is an international treaty associated with the reduction of what?",Greenhouse Gas Emissions,The Kyoto Protocol is associated with the reduction of greenhouse gas emissions.
Who is the current President of China in 2024?,Xi Jinping,Xi Jinping is the current President of China.
"The ""Andes Mountains"" run through which South American countries?",Chile and Argentina,The Andes Mountains run through Chile and Argentina in South America.
"In 2024, which country launched the first-ever space mission to explore the moons of Jupiter?",United States,The United States launched a mission to explore the moons of Jupiter in 2024.
Which international organization is responsible for maintaining global peace and security?,United Nations,The United Nations is responsible for maintaining global peace and security.
"The ""Gobi Desert"" is located in which part of Asia?",Northwest,The Gobi Desert is located in the northwest part of Asia.
"In 2024, which country became the first to achieve 100% renewable energy production?",Costa Rica,Costa Rica achieved 100% renewable energy production in 2024.
"The ""Panama Canal"" connects which two major bodies of water?",Pacific Ocean and Caribbean Sea,The Panama Canal connects the Pacific Ocean and the Caribbean Sea.
Who is the current Prime Minister of Canada in 2024?,Justin Trudeau,Justin Trudeau is the current Prime Minister of Canada.
"The ""Himalayas"" is a mountain range that spans across how many countries?",5,The Himalayas span across five countries.
Which country recently became the first to successfully test a hypersonic missile in 2024?,China,China successfully tested a hypersonic missile in 2024.
Which country recently became the first to implement a nationwide ban on single-use plastic bottles?,France,France implemented a nationwide ban on single-use plastic bottles in 2024.
"The ""Green Climate Fund"" is designed to assist developing countries in addressing and mitigating the impacts of what?",Climate Change,The Green Climate Fund addresses the impacts of climate change in developing countries.
Who is the current Prime Minister of Japan in 2024?,Yoshihide Suga,Yoshihide Suga is the current Prime Minister of Japan.
"In 2024, which country achieved a major breakthrough in fusion energy research?",United States,The United States achieved a major breakthrough in fusion energy research in 2024.
"The ""Amazon Rainforest"" is primarily located in which South American country?",Brazil,The Amazon Rainforest is primarily located in Brazil.
Which global organization focuses on the promotion of human rights and advocates for their protection worldwide?,Amnesty International,Amnesty International focuses on the promotion and protection of human rights globally.
"In 2024, which city hosted the Summer Olympic Games?",Paris,Paris hosted the Summer Olympic Games in 2024.
"The ""Ring of Fire"" is a major area in the basin of which ocean, known for its frequent earthquakes and volcanic activity?",Pacific Ocean,The Ring of Fire is located in the basin of the Pacific Ocean.
Who is the current President of Russia in 2024?,Vladimir Putin,Vladimir Putin is the current President of Russia.
"The ""Hubble Space Telescope"" has provided valuable insights into which scientific field?",Astronomy,The Hubble Space Telescope has provided valuable insights into the field of astronomy.
"In 2024, which country became the first to launch a nationwide 6G network?",South Korea,South Korea launched the first nationwide 6G network in 2024.
"The ""G7"" is a group of major advanced economies. Which country is not a member of the G7?",India,India is not a member of the G7.
Which international organization focuses on the promotion of labor rights and the improvement of working conditions globally?,International Labour Organization (ILO),ILO focuses on labor rights and working conditions worldwide.
"In 2024, which country launched the first-ever mission to explore the icy moons of Saturn?",United States,The United States launched a mission to explore the icy moons of Saturn in 2024.
"The ""Arctic Council"" is an intergovernmental forum focusing on issues related to which region?",Arctic Region,The Arctic Council focuses on issues related to the Arctic Region.
Who is the current Chancellor of Germany in 2024?,Olaf Scholz,Olaf Scholz is the current Chancellor of Germany.
"The ""Yellow River"" is the second-longest river in which country?",China,The Yellow River is the second-longest river in China.
"In 2024, which country became the first to achieve a carbon-negative status?",Bhutan,Bhutan achieved carbon-negative status in 2024.
"The ""World Health Organization (WHO)"" is a specialized agency of which international organization?",United Nations,WHO is a specialized agency of the United Nations.
Which country recently became the first to deploy a fully operational robot police force in 2024?,United Arab Emirates,The United Arab Emirates deployed a fully operational robot police force in 2024.
"The ""Suez Canal"" connects which two major bodies of water?",Red Sea and Mediterranean Sea,The Suez Canal connects the Red Sea and the Mediterranean Sea.
"In 2024, which country launched the first-ever mission to explore the atmosphere of Mars?",United States,The United States launched a mission to explore the atmosphere of Mars in 2024.
"The ""Ganges River"" is considered sacred in which major religion?",Hinduism,The Ganges River is considered sacred in Hinduism.
Who is the current Prime Minister of Italy in 2024?,Mario Draghi,Mario Draghi is the current Prime Minister of Italy.
"The ""Australian Open"" is a major sporting event in which sport?",Tennis,The Australian Open is a major tennis event.
"In 2024, which city hosted the Winter Olympic Games?",Pyeongchang,Pyeongchang hosted the Winter Olympic Games in 2024.
"The ""African Union"" is a continental union consisting of how many member states?",54,The African Union consists of 54 member states.
Who is the current President of Brazil in 2024?,Jair Bolsonaro,Jair Bolsonaro is the current President of Brazil.
"The ""Mekong River"" flows through how many countries in Southeast Asia?",6,The Mekong River flows through six countries in Southeast Asia.
"In 2024, which country launched the first-ever mission to explore the subsurface ocean of Europa, one of Jupiter's moons?",United States,The United States launched a mission to explore the subsurface ocean of Europa in 2024.
"The ""Great Barrier Reef"" is located off the coast of which Australian state?",Queensland,"The Great Barrier Reef is located off the coast of Queensland, Australia."
Who is the current Prime Minister of India in 2024?,Narendra Modi,Narendra Modi is the current Prime Minister of India.
"The ""Mediterranean Sea"" is connected to the Atlantic Ocean through which strait?",Gibraltar Strait,The Mediterranean Sea is connected to the Atlantic Ocean through the Gibraltar Strait.
"In 2024, which country became the first to successfully test an anti-satellite missile, demonstrating its capability to destroy satellites in orbit?",India,India successfully tested an anti-satellite missile in 2024.
"The ""European Central Bank"" is headquartered in which city?",Frankfurt,"The European Central Bank is headquartered in Frankfurt, Germany."
Who is the current President of France in 2024?,Emmanuel Macron,Emmanuel Macron is the current President of France.
"The ""Danube River"" is the second-longest river in Europe. Through how many countries does it flow?",10,The Danube River flows through ten countries in Europe.
"In 2024, which country became the first to launch a satellite powered by nuclear propulsion?",Russia,Russia launched a satellite powered by nuclear propulsion in 2024.
"The ""Black Sea"" is connected to the Mediterranean Sea through which strait?",Bosporus Strait,The Black Sea is connected to the Mediterranean Sea through the Bosporus Strait.
Who is the current Prime Minister of the United Kingdom in 2024?,Boris Johnson,Boris Johnson is the current Prime Minister of the United Kingdom.
"The ""CERN"" (European Organization for Nuclear Research) is located on the border of which two countries?",Switzerland and France,CERN is located on the border of Switzerland and France.
"In 2024, which country became the first to deploy a fully operational autonomous drone delivery service?",Australia,Australia deployed a fully operational autonomous drone delivery service in 2024.
"The ""Dead Sea"" is bordered by which two countries?",Jordan and Israel,The Dead Sea is bordered by Jordan and Israel.
Who is the current Prime Minister of South Korea in 2024?,Moon Jae-in,Moon Jae-in is the current Prime Minister of South Korea.